1,,,,,"(ISSUED WITH MILITIA ORDERS, 1917.)",Canadian Expeditionary,Force,140th BATTALION,"Nominal Roll of Officers, Non-Commissioned",Officers and Men.,EMBARKATION,"Port: Halifax, N.S.","3m-8-17. Ship: S.S. ""Corsican.""","591-2-29. Date: September 25th, 1916."
2,382,1939,422,2374,140th BATTALION
2,509,3372,533,3683,Taken on Strength.
2,541,589,589,3243,a i,,,Country of
2,559,2478,585,2821,Address of Next of Kin.
2,560,745,584,830,Rank.
2,560,1478,589,1685,Former Corps.
2,560,1844,585,2156,Name of Next of Kin.
2,561,1120,584,1214,Name.
2,588,3121,611,3209,Birth.
2,603,3606,628,3685,Date.
2,604,580,643,603,<3
2,604,3366,628,3451,Place.
2,702,661,733,3739,"Lieut.-Colonel... Beer, Lewis Herbert L.S.H.,","Beer, Mrs. Winifred G ","335 Chapel St., Ottawa, Ont ",,Valcartier C'p..,". 13,1916."
2,732,660,764,3740,"Major Carter, Albert Desbrisay 26th Bn","Carter, Mrs. Ettie ","Pointe de Bute, Westmoreland Co., N.B ",,St. John ,"19, 1916."
2,761,661,792,3740,"Major Perley, Harold... ^ rs 62nd Re","Perley, Mrs. Laura C ","291 Germain St.-, St. John, N.B ",,Valcartier C’p..,". 13,1916."
2,787,659,822,3740,"Major Priestman, Herbert. 71st Reg","Priestman, Mrs. Minnie Helen.","Goughian, Northumberland Co., N.B ",,,"20, 1916."
2,819,659,850,3740,"Major Rush, Frederick Charles L.S.H.","Rush, Mrs. Jessie Anderson...","363 Langside St., Winnipeg, Man ",England ,Valcartier C’p..,". 13, 1916."
2,848,658,880,3738,"Major Young, Frank Bennett 62nd Re","Young, Mrs. Vera Constance..","34 Wright St., St. John, N.B ",,Valcartier C’p..,". 16, 1916."
2,875,657,909,3739,"Captain Bell, Dugald Stewart C.A.S.C","Bell, Mrs. Frances S ","18 Garden St., St. John, N.B ",,Valcartier C’p..,". 13, 1916."
2,904,658,938,3739,"Hon. Captain Conron, Matthew English Can. Mi","Conron, Mrs. Rose H ","306 Johnson Ave., Elmwood, Winnipeg, Man ",,Valcartier C’p..,19.1916.
2,935,658,967,3739,"Hon. Captain.... Harper, James EUiott 62nd Reg","Harper, Mrs. Clare Young ","269 Princess St., St. John, N.B  ",,St. John ,20.1916.
2,963,655,996,3739,"Captain Lounsbury, George Holland 62nd Re","Lounsbury, Mrs. Greta ","27 Elliott Row, St. John, N.B ",,,18.1916.
2,993,655,1024,3739,"Captain Malcolm, Donald Campbell C.A.M.C","Malcolm, Mrs. Jennie Scott..","Fair Vale, King’s Co., N.B ",,,21.1916.
2,1022,655,1054,3738,"Captain Newcomb, Frederick James 74th Reg","Newcomb, Mrs. Annie Bell..","64 Spring St., St. John, N.B; ",,,"19, 1916."
2,1051,656,1083,3739,"Hon. Captain Patchell, Joseph Beville 74th Rei","MacFarlane, Mrs. Elizabeth.","97 Simonds St., St. John, N.B ",,,18.1916.
2,1080,654,1111,3739,"Captain Smith, Ernest Earl B 67th R01","Smith, Mrs. E. F   ","35 Harrison St., Milltown, Me., U.S.A ",,,"30, 1916."
2,1108,654,1141,3738,"Captain Teed, William Harold 62nd»Reg","Teed, Rev. Arthur W ","Windsor, Hants Co., N.S  ",,,7.1916.
2,1134,653,1169,3738,"Lieutenant Armstrong, Frank 74th Rei","Armstrong, Mrs. Annie ","Sussex, King’s Co., N.B ",,St. John ,19.1916.
2,1166,653,1198,3739,"Lieutenant Armstrong, Robert McLaren C.O.T.C","Armstrong, Henry S ","9 Archibald St., Moncton, N.B ",,,"7, 1916."
2,1196,653,1228,3738,"Lieutenant Ashford, Hugh Garrett 28th Drags","Ashford, Mrs. Carrie W ","c/o J. Starr Tait, Prince William St., St. John, N.B ",,,30.1916.
2,1221,653,1257,3738,"Lieutenant Bennett, James 71st Regt","Bennett, Mrs. Priscilla ","Halesowen, Worcs, Eng ",,St. John ,20.1916.
2,1253,652,1286,3738,"Lieutenant Brown, William James  62nd Rei","Brown, Mrs. Kate May W...","326 Rockland St., St. John, N.B  ",,Valcartier C’p..,20.1916.
2,1279,651,1314,3738,"Lieutenant Calkin, James Ryan 8th Huss","Calkin, J. O ","Sackville, Westmoreland Co., N.B ",,Andover ,30.1916.
2,1308,651,1344,3777,"Lieutenant Cronin, Edward John 62nd Reg","Cronin, John F ","Milltown, Charlotte Co., N.B ",,,7.1916. •<*
2,1338,650,1373,3733,"Lieutenant Edgett, Louis Stanley 74th Regt","Steeves, Mrs. Annie B ","Hillsborough, Albert Co., N.B   ",,St. John ,20.1916.
2,1366,650,1402,3733,"Lieutenant Good, Allan Wilfred G 71st Reg","Good, Major F. A ","140th Batt., C.E.F., c/o Army P.O., London, Eng ",,Fredericton ,Canada ,7.1916.
2,1398,650,1430,3733,"Lieutenant.. Grimmer, George Stuart 28th Dra","Grimmer, Mrs. Jean C ","Perry’s Point, King’s Co., N.B ",,Valcartier C’p..,Canada ,13.1916.
2,1428,649,1460,3736,"Lieutenant McDougall, William Allan   67th Reg","McDougall, Mrs. Sarah ","Debec, Carleton Co., N.B      ",,Hartland ,Canada ,31.1916.
2,1456,648,1489,3731,"Lieutenant MacFarlane, Robert Bruce 71st Reg","McFarlane, Mrs. Emma Jane ","Saunders St., Fredericton, N.B ",,Federicton ,Canada ,7.1916.
2,1485,648,1517,3735,"Lieutenant McGinley, Willard Gordon 28th Dra","McGinley, Mrs. Ada Blanche.","90 Exmouth St., St. John, N.B ",,Valcartier C’p..,1.1916.
2,1511,647,1547,3520,"Lieutenant Osgood, Giles Dever 74th Reg","Osgood, Mrs. Edith Hazel...","Sussex, King’s Co., N.B ",,St. John 
2,1541,646,1575,3520,"Lieutenant Roxborough, Ebeneier Sutton 62nd Reg","Roxborough, Mrs. Emily Dingle..","252 Duke St., West St. John, N.B ",,Andover ,Canada 
2,1570,645,1604,3519,"Lieutenant  Steven, Peel Otis D. 74th Regt","Steven, Mrs. Millicent Madge ","P.O. Box 94, Moncton, N.B ",,St. John ,Canada 
2,1601,645,1633,3519,"Lieutenant Thorne, Alexander Wetherell 28th Drags","Thorne, Mrs. May Isabell ","350 Duke St., West St. John, N.B ",,Valcarteir C’p..,Canada 
2,1627,645,1662,3518,"Lieutenant Wilson, Robert Benjamin E 67th Reg","Wilson, Mrs. Benjamin ","Hartford, Carleton Co., N.B ",,Valcartier C’p..,Canada 
2,1659,543,1690,3520,818191,"Private Achorn, Lester Bruhut  Nil ","Gibson, Mrs. Blanche ","Fort Fairfield, Me., U.S.A ",West St. John...,Canada 
2,1684,542,1719,3727,817222,"Private Acker, Charles Roy Nil ","Acker, Mrs. Eliznbeth Jane ","Rooth Station, York Co., N.B ",Sussex ,Canada ,". 28,1915,"
2,1714,542,1748,3827,818236,"Private Acquin, Gabriel Frederick 67th Regt","Acquin, Mrs. Cecile ","Old Town, Me., U.S.A ",West St. John...,Canada ,7.1918.;—;^.
2,1730,542,1777,3773,817443,"Private Adair, William Earl Nil ","Adair, Mrs. Annie ","Newcastle, Northumberland Co., N.B ",,24.1915.#
2,1773,541,1806,3731,817774,"Private Adams, George Raymond Nil ","Adams, Mrs. E ","58 City Rd., St. John, N.B ",,". 15,1915."
2,1786,542,1840,3768,817399,"Private Adams, George William C.A.S.C.","Adams, Mrs. May ","* Broadview Ave., St. John, N.B ",Not stated ,St. John ,2.1918.^-
2,1830,541,1864,3732,818109,"Private Akerley, David MacDonald O.G.A..","Akerley, Mrs. Florence ","Fairmount, East St. John, N.B ",West St. John...,31 1918.
2,1859,542,1892,3731,817001,"Sergeant Akerly, Harold Gladstone Nil ","Akerly, Oliver B ","61 Peters St., St. John, N.B ",Sussex  ,10.1915.
2,1888,541,1922,3770,817871,"Private Allan, Frederick Gorden 62nd Regt","Allan, Mrs. Ellen ","49 St. David St., St. John, N.B ",West St. John...,28.1916. >-
2,1917,540,1951,3752,8i8112,"Private Allen, Edward 71st Regt","Allen, Mrs. Matilda ","Burtt’s Corner, York Co., N.B ",West St. John...,"30.1916. ,"
2,1945,539,1979,3732,817565,"Corporal Allen, Samuel Warren Nil...","Finnamore, Mrs. Howard ","Odell River, Victoria Co., N.B ",,31.1915.
2,1974,539,2009,3765,817567,"Private Anderson, Ronald Craig Nil...","Anderson, William ","Perth, Victoria Co., N.B ",,"10.1916. """
2,2003,538,2038,3733,817201,"Private Andrews, Hugh  Nil...","Andrews, Mrs. Amanda ","71 Metcalf St., St. John, N.B ",,16.1915.
2,2032,538,2066,3733,817002,"Private Andrews, Leonard William Nil...","Andrews, William ","32 Charles St., St. John, N.B ",,9.1915.
2,2061,537,2096,3734,817815,"Private Appleby, William  Nil...","Appleby, Joseph ","Sagawa, Queen’s Co., N.B ",,21.1915.
2,2090,537,2125,3736,817571,"Private Armstrong, Frederick Nil...","Armstrong, Thomas ","Perth, Victoria Co., N.B ",,8.1915.
3,380,661,413,3862,817937,Private ,"Armstrong, William Milas...",Nil ,"Armstrong, Adolphus Henry","Oromocto, Sunbury Co., N.B ",,1916.
3,408,662,441,3862,817735,Private ,"Arsenault, William ",C.G.A  ,"Arsenault, Fred ","Govan, Sask ",Nov.,9,1915.
3,437,662,470,3862,817333,Private  ,"Atchison, James ",Nil ,"Atchison, Robert ","19 Athela St., Lochee, Dundee, Scot ",St. John ,Dec. 31,1915.
3,467,663,500,3862,81734-5,Private ,"Baker, Hartley Smith ",Nil ,"Baker, Mrs. Ruby E ","Victoria, Carleton Co., N.B ",St. John ,Mar,14,1916.
3,468,3173,492,3402,CtlDAdft 
3,496,663,528,3862,817312,Private ,"Banks, William Cuthbjrt....",Nil ,"Banks, Mrs. Julia ","Central Blissville, Sunbury Co., N.B ","Feb,",3,1916.
3,524,664,559,3853,817993,Private ,"Barber, Walter Thomis ",Nil ,"Barber, Mrs. Amy ","Pembroke, Carleton Co., N.B ",Mar.,22,1916
3,526,3173,554,3288,Fnglnjid
3,554,664,587,3862,817951,Private ,"Barnes, Reuben ",Nil  ,"Barnes, Mrs. Gertie Alward","Norton Dale, York Co., N.B ",Mar.,10,1916.
3,556,3175,579,3401,U.S.A 
3,583,665,615,3861,817833,Private ,"Barter, Samuel Gilbert ",Can. Mil ,"Barter, Mrs. Lottie ","Avondale, Carleton Co., N.B ",Mar.,1,1916.
3,612,664,645,3861,813i73,Private ,"Bates, Eldon Roy ",Nil ,"Bates, Lewis ","Campbell Settlement, York Co., N.B ",Amil 11,1916.
3,642,665,674,3862,817459,Private ,"Baiter, Walter ",Nil ,"Baxter, Mrs. Annie L ","176 Queen St., Fredericton, N.B ",Nov.,8,1915.
3,672,666,703,3862,817417,Private ,"Beairsto, John Archibald....",Can. Mil ,"Beairsto, Mrs. Annie ","St. Mary's, York Co., N.B ",Sussex ,1915.
3,700,665,733,3861,817935,Private ,"Beaumont, Howard Hirold..",Nil ,"Beaumont, George E ","Hillsborough, Albert Co., N.B ",Mar,22,1916.
3,731,666,761,3862,817037,Private ,"Beckwith, John Francis ",Nil ,"Beeckwith, Arthur ","1 Mile House, St. John, N.B ",,1915.
3,758,665,790,3853,817775,Private ,"Beckwith, Osoar Frederick..",Nil ,"Beckwith, Mrs. Alice ","17 St. Paul St., St. John, N.B ",Nov. 10,1915
3,788,666,820,3853,817813,Private ,"Beech, Thomas ",Nil ,"Beech, Mrs. Lily Rose E....","96 Winter St., St. John, N.B ","Feb,",8,1916
3,816,665,849,3861,817093,Private ,"Beers, Robert ",Nil ,"Beers, Mrs. Margaret ","35 Gilbert’s St., St. John, N.B ",Sept. 28,.1915.
3,845,666,879,3862,817225,Private ,"Beesley, Charles Hastings W.",Nil ,"Beesley, H ","408 Main St., St. John, N.B ",SeDt. 29,1915.
3,874,666,908,3861,817093,Private ,"Beesley, Grover Cleveland..",Nil ,"Beesley, William D ","HolderviUe, King’s Co., N.B ",Nov.,2,1915.
3,903,666,937,3862,817095,Private ,"Beesley, John Wesley ",Nil ,"Beesley, Mrs. Minnie ","Holderville, King’s Co., N.B ",Nov.,"?,",1915.
3,931,666,966,3853,817093,Private ,"Belding, Harry Dibblee ",Nil ,"Belding, Mrs. Annie :","Hampton, King’s Co., N.B  ",Nov.,e>,1915
3,962,666,995,3862,817010,Private ,"Bell, Andrew Edward ",Nil ,"Bell, Mra. Annie. ","Apohaqui, King’s Co., N.B ",Nov.,9,1915.
3,991,666,1026,3860,81722:,:3| Private ,"Bell, Joseph Thomas ",Nil ,"Bell, Mrs. Margaret ","Grand Falls, Victoria Co., N.B ",Jan.,13,"1916,"
3,1021,666,1054,3862,817574,Private ,"Bell, Raymond Malachi ",Nil ,"Bell, Herbert ","East Corinth, Me., U.S.A ",,5,1916.
3,1022,3173,1047,3402,U.S.A 
3,1048,666,1082,3853,817575,Private ,"Bell, Vinee A ",Nil  ,"Bell, David ","Bristol, Carleton Co., N.B ",Dec.,28,1915
3,1078,666,1112,3860,817451,Private ,"Belyea, William ",Nil  ,"Belyea, Mrs. Winnifred ","238 Charlotte St., Fredericton, N.B ",Dec.,2,"1915,"
3,1107,666,1140,3861,818035,Private ,"Bent, Edward Abraham ",Nd  ,"Bent, Mrs. Frances ","Young’s Cove, Annapolis Co., N.S ",West St. John...,Mar.,28,1916.
3,1136,666,1170,3861,818232,Private ,"Best, John ",Nil  ,"Best, John..., ","Stanley, York Co., N.B ",May,30,1916.
3,1165,666,1200,3862,817831,Private ,"Bettaney, Reginald ",Imp. Forces ,"Bettaney, Sidney ","164 Broad St., Hanley, Staffs, Eng ",Feb.,West St. John...,29,1916.
3,1192,666,1228,3861,817012,Co. Q.-M. Sirgt.,"Bettle, Harry Howard ",NU  ,"Bettle, Mrs. Sarah T ","70 Dorchester St., St. John, N.B ",Dec.,2,1915.
3,1222,666,1257,3853,81723?,Private ,"Betts, John Wilford ",Nil ,"Betts, Wilford W ","30 George St., Fairville, St. John Co., N.B ",Nov.,10,1915
3,1251,666,1287,3861,817239,Corporal ,"Bickerstaffe, Robert ",Nil ,"Bickertsafle, Mrs. Annie ","298 Wentworth St., St. John, N.B.. ",Oct.,11,1915.
3,1281,666,1315,3853,817331,Private ,"Bickerstaffe, Robert Dniels.",Nil ,"Bickerstaffe, Mrs. Annie ","298 Wentworth St., St. John, N.B ",Jan.,7,1916
3,1309,666,1346,3861,817316,Private ,"Billings, James D.ivid ",Nil ,"Billings, Mrs. Allred ","No. 2, Paxton Rd., Birmingham, Eng ",Oct.,20,1915.
3,1338,666,1375,3860,817452,Corporal ,"Billingsley, Thomas ",Nil ,"Billingsley, Jennie ","523 Tremont St., Boston, Mass., U.S.A ",Dec.,30,1915.
3,1367,666,1403,3861,813157,Private ,"Bird, John Douglas ",Nil ,"Bird, Mrs. Jennie ","Birdton, York Co., N.B ",West St. John...,April,4,1916.
3,1396,666,1431,3860,817291,Private ,"Blackhall, Frank ",Nil ,"Blackhall, Amelia ","East St. John, N.B ",Dec.,7,"1915,"
3,1425,666,1462,3860,817*53,3>rgj»nt ,"Blair, Howard Hitchings. ...",Nil ,"Blair, Mra. Linna Maud ","166 Brunswick St., Fredoricton, N.B ",Nov.,23,1915.
3,1454,666,1491,3860,817776,Private ,"Blakney, George Albert ",Nil ,"Blakney, William ","Sunny Brae, Moncton, N.B   ",Nov. 15,1915.
3,1484,665,1520,3860,817913,Private ,"Blakney, Norm\n Lee ",Nil ,"Blakney, Norman S ","Golden Grove, St. John Co., N.B ",Nov.,4,1915.
3,1512,665,1548,3860,817413,Private ,"Blanchard, Amo3.  ",Nil ,"Blanchard, Andrew ","St. Joseph’s, Gloucester Co., N.B ",Oct.,21,1915.
3,1540,665,1578,3860,817419,Private ,"Blanchard, AugQ3tin ",Nil ,"Blanchard, Emanuel ","Mixonette, Gloucester Co., N.B ",Oct.,21,1915.
3,1569,666,1606,3860,813189,Private ,"Blank, John Wilson ",Nil ,"Blank, Thompson ","St. Mary’s Ferry, York Co., N.B ",West St. John...,April,5,1916.
3,1599,666,1635,3860,817333,Private ,"Bonnar, Edward Franklin ",Nil ,"Bonnar, William ","Victoria Mills, Fredericton, N.B ",Feb.,28,1916.
3,1629,665,1664,3860,817974,Private ,"Bonnar, Hubert Little ",Nil ,"Bonnar, Mra. Jennie ","Marysville, York Co., N.B ",Mar.,17,1916.
3,1658,666,1692,3860,817975,Private ,"Bonnar, James Robert ",Nil ,"Bonnar, Mra. Elizabeth ","Fredericton, York Co., N.B ",Mar.,17,1916.
3,1686,666,1721,3860,817957,Private ,"Booker, Frederick ",Nil ,"Booker, Mrs. Sadie ","Perth, Victoria Co., N.B ",Mar.,15,1916.
3,1715,666,1753,3860,817918,Private ,"Boone, James Henry ",7lBt Regt ,"Boone, Reuben ","Cross Creek, York Co., N.B ",West St. John...,Mar.,6,1916.
3,1743,666,1780,3861,818183,Private ,"Boone, Lloyd Bartlett ",Nil ,"Boone, Ransford ","Burtt’s Corner, York Co., N.B... .’  ",West St. John...,Anril 11,1916.
3,1774,666,1808,3861,817891,Private ,"Boone, William Cecil ",Nil ,"Boone, Mrs. Alma  ","Burtt’s Corner, York Co., N.B  ",West St. John...,Mar.,1,1916.
3,1802,667,1839,3860,817421,Corporal ,"Boudreau, Francis Xavier...",Nil ,"Legere, Mrs. Calixte ","Little Cape, Westmoreland Co., N.B.. ",Oct.,15,1915.
3,1831,667,1868,3860,817817,Private.. ,"Boudreau, Joseph Amedee...",Can. Mil  ,"Boudreau, Aime ","Dorchester Rd., Westmoreland Co., N.B ",July,7,1916.
3,1861,668,1898,3859,817205,Private ,"Bourque, Albert ",Nil ,"Bourque, Carzan ","Cocagne, Kent Co., N.B ",Nov. 10,1915.
3,1890,668,1927,3852,817836,Private ,"Bourque, Edward Edmund..",Nil ,"Bourque, Edmund  ","Painsec Settlement, Westmoreland Co., N.B ",June,9,1916
3,1919,668,1956,3853,817454,Private ,"Boyd, Charles David ",Nil ,"Boyd, Mrs. Crascillia  ","995 Hyde Park Ave., Boston, Mass., U.S.A ",Jan.,28,1916
3,1948,668,1985,3859,817426,Private ,"Boyd, James William ",Nil ,"Boyd, Mrs. M ","St.John, N.B ",Sept. 15,1915.
3,1977,667,2015,3861,817577,Private ,"Boyer, Cecil Gordon ",Nil ,"Boyer, Mrs. Emily E ","Hartland, Carleton Co., N.B ",Oct.,12,1915.
3,2006,668,2044,3862,817992,Private ,"Boyle, James Beal ",Nil ,"Boyle, John   ","Waasis, Sunbury Co., N.B ",West St. John...,Mar.,22,1916.
3,2035,667,2073,3861,817890,Sergeant ,"Bradbury, John Thomas ",74th Regt ,"Bradbury, Mrs. Annie ","100 Dorchester St., St. John, N.B ",Mar.,1,1916.
3,2064,669,2102,3862,817578,Private ,"Bradley, Herbert Leonard...",Nil ,"Grant, Mrs. Eliza ","Hartland, Carleton Co., N.B ",Dec.,31,1915.
3,2093,669,2131,3863,317972,Private ,"Brawn, Harvey Alexander...",Nil   ,"Brawn, Henry ","Gaspereaux Station, Queen’s Co., N.B ",Mar.,8,1916.
4,412,2016,450,2356,140th Battalion
4,532,3401,555,3710,Taken on Strength.
4,581,3122,609,3274,Country of
4,587,775,618,2852,,,,Former Corps.
4,587,2508,613,2852,Address of Next of Kin.
4,591,1874,615,2184,Namo of Next of Kin.
4,593,1148,616,1240,Name.
4,594,775,618,859,Rank.
4,610,3153,634,3239,Birth.
4,626,3395,650,3482,Place.
4,626,3635,649,3713,Date.
4,725,3083,751,3767,,,,,,,,Canada ,St. John ,Mar.,"7, 1916."
4,733,589,767,2803,817930,Private ,"Brayall, Mansfield ",Nil  ,"Welsh, Reuben ","Fort Fairfield,Me., U.S.A "
4,754,3082,780,3767,,,,,,,,Canada ,Sussex ,Nov.,10.1915.
4,762,588,796,2802,«17232,Private ,"Breau, Amedee Fulgence... ",Nil ,"Breau, Fulgence ","Cocagne, Kent Co., N.B "
4,783,3082,809,3767,,,,,,,,Canada ,Sussex ,Oct.,"29, 1915."
4,792,588,825,2801,817402,Private ,"Breault, Arcade ",Nil ,"Breault, Mrs. Julia ","Tracadie, Gloucester Co., N.B "
4,811,586,855,3767,817579,Private ,"Breen, Leonard Phillip ",Nil ,"Breen, Mrs. John ","683 Main St., St. John, N.B ",,Canada ,Sussex ,Nov.,"4, 1915."
4,840,586,884,3767,81823C,Private ,"Brewer, Vernon Bertrand ",71st Regt ,"Brewer, Mrs. Celia ","Cross Creek, York Co., N.B ",,Canada ,St. John ,May,30.1916.
4,869,585,913,3769,817234,Private ,"Brindle, Norman ",Nil ,"Brindle, Walter ","250 Wentworth St., St. John, N.B...",,England ,Sussex ,Sept.,"27, 1915."
4,898,585,942,3768,817876,Private ,"Brittain, Ralph Owen ",Nil ,"Brittain, Willard Ellison ","33 Pitt St., St. John, N.B ",,Canada ,St. John ,Feb.,"29, 1916."
4,927,585,974,3766,817580,Corporal ,"Britton, Edward Albert ",Nil ,"Britton, Mrs. Annie ","Windsor, Carleton Co., N.B ",,Canada ,Sussex ,Nov.,30.1915.
4,956,585,999,3767,818193,Private ,"Broad, Emerson, Bennett ",R. Can. Eng..,"Broad, Mrs. Eliza ","Holmesville, Carleton Co., N.B....",,Canada ,West St. John..,April,14.1916.
4,986,586,1027,3766,817581,Private ,"Broad, Wilmot ",Nil ,"Broad, Charles ","Beechwood, Carleton Co., N.B ",,Canada ,Sussex ,Jan.,"5, 1916."
4,1015,586,1056,3766,818251,Private ,"Brookins, Harold Leslie ",Nil ,"Brookins, Mrs. Frances ","47 Moore St., St. John, N.B ",,Canada ,St. John ,June,"24, i916."
4,1044,586,1084,3766,818028,Private ,"Brown, Alexander Richard....",Nil ,"Brown, William T ","Carroll's Crossing, Northumberland","Co.,",Canada ,West St. John..,Mar.,"23, 1916."
4,1073,587,1112,3766,817872,Private ,"Brown, Everett Earle ",Nil ,"Brown, John L ","Parrsboro', Cumberland Co., N.S...",,Canada ,St. John.......,Feb.,28.1916.
4,1102,587,1142,3766,817014,Private ,"Brown, Henry Watt  ",Nil ,"Brown, Mrs. Florence E ","38 Forest St., St. John, N.B ",,England ,Sussex ,Oct.,"21, 1915."
4,1131,586,1170,3766,817977,Private ,"Brown, Merle Clinton ",Nil...... ,"Brown, Mrs. Laney ","Carlingford, Victoria Co., N.B ",,Canada ,St. John ,Mar.,17.1916.
4,1160,587,1199,3766,817015,Private ,"Brown, Richard Alexander....",C.F.A ,"Brown, Mrs. Elizabeth ","6 Cannon St., St. John, N.B ",,Canada ,Sussex ,Nov.,"16, 1915."
4,1189,586,1228,3767,817967,Private ,"Brown, Roy Ross ",Nil ,"Brown, Mrs. Hermas ","Petitcodiac, Westmoreland Co., N.B",,Canada ,St. John ,Mar.,"7, 1916."
4,1217,586,1257,3768,817016,Private ,"Buckley, George Myrtle ",Nil ,"Buckley, Mrs. George ","109 Hilyard St., St. John, N.B ",,Canada ,Sussex ,Oct.,"19, 1915."
4,1245,584,1287,3768,817018,Private ,"Btilmer, Oscar Harold ",Nil ,"Bulmer, Mrs. Lattica ","Cherryfield, Westmoreland Co., N.B",,Canada ,Sussex ,Nov.,17.1915.
4,1273,583,1315,3769,817844,Private ,"Bunker, Harold LeRoy ",Nil ,"Bunker, Mrs. Lillian B ","Waasis, Sunbury Co., N.B ",,Canada ,St. John ,Feb.,"8, 19.6."
4,1301,580,1344,3769,818192,Private ,"Burke, John ",Nil ,"McManus, Mrs. Mary ","10 Grosvenor St., Liverpool, Lancs,",Eng.,England ,West St. John..,April,"14, 1916."
4,1330,579,1374,3770,818013,Private ,"Burton, William    ",Nil ,"Burton, John ","Cape North, C.B., N.S ",,Canada ,West St. John..,Mar.,"20, 1916."
4,1359,579,1402,3771,709453,Private ,"Cadman, Charles Augustine B.",Nil ,"Cadman, Estella ","Anderson Settlement, N.B .. ",,Canada ,Sussex ,Oct.,16.1915.
4,1387,576,1430,3771,817019,Private ,"Cady, John Joseph  ",Nil  ,"Cady, George ","456 Main St., St. John, N.B t",,Canada ,Sussex ,Nov.,"17, 1915."
4,1415,573,1456,3771,81810S,Privnto ,"Cairons, Howard Smithers ",Nil ,"Cairens, Archibald William....","St. Martin's, St. John Co., N.B ",,Canada ,West St. John..,April,"5, 1916."
4,1445,572,1484,3771,817230,Private ,"Calkin, Hinson Wakeman ",Nil ,"Calkin, W ","647 Union St., Moncton, N.B ",,U.S.A  ,Sussex ,Nov.,"9, 1915."
4,1474,572,1513,3771,817020,Private ,"Callahan, Leslie Dennis ",Nil. ,"Callahan, Mrs. Catherine ","220 Brussels St., St. John, N.B ",,Canada ,Sussex ,Nov.,"15, 1915."
4,1503,571,1542,3771,817023,Privato ,"Campboll, Albert Burnie ",Nil ,"Campbell, Mrs. Blare ","Andover, Victoria Co., N.B ",,Canada.... ,Sussex ,Nov.,"22, 1915."
4,1532,571,1571,3771,817253,Private ,"Campbell, Basil Howard ",Nil ,"Campbell, Mrs. Augusta ","Birch Ridge, Victoria Co., N.B ",,Canada ,Sussex ,Dec.,"31, 1915."
4,1561,571,1599,3771,817021,Privato ,"Campbell, Frank Dofost ",Nil ,"Campbell, John ","King St. Corner, Market PI., West",St,Joh,Canada ,Sussex ,Nov.,"10, 1915."
4,1589,571,1630,3770,817238,Corporal ,"Campboll, Leigh tlorooe ",Nil ,"Campbell, Mrs. Mina B ","St. Andrews, Charlotte Co., N.B...",,Canada ,Sussex..   ,Dec.,"3, 1915."
4,1618,573,1657,3770,817753,Scrgt.-Drummor,"Cannon, Henry ",Nil ,"Cannon, Mrs. F. E ","6 Bryden St., St.John, N.B ",,England ,Sussex ,Sept.,"10, 1915."
4,1646,576,1684,3769,818257,Sergeant ,"Carpenter, Eawln James ",Nil ,"Carpenter, Mrs. Elisabeth Jano","50 Winter St., St. John. N.B ",,Canada ,Valcartier C'p.,Sept.,"8, 1916."
4,1674,577,1711,3769,818021,Private ,"Carson, Lawrenoe Burton ",Uh Hum ,"Carson, Mrs. Glonnie Poarl ","Havelock, King’s Co., N.B ",,Canada ,West St. John..,Mar.,22.1916.
4,1703,579,1739,3769,817024,Private ,"Carson, Robert ",Nil ' ,"Carson, Mrs. Lena ","38 Paradiso Row, St. John, N.B....",,Canada ,Sussex ,Nov.,"3,1915."
4,1732,580,1769,3769,817589,Private ,"Cartin, Patrick Henry ",Nil ,"Cartin, Mrs. Holon ","856 Browney Ave., Scranton, Ponn.,",",S.A",U.S.A ,Sussex ,Nov.,"27, 1915."
4,1761,580,1795,3769,817779,Private ,"Case, Ernest Whitford ",Nil ,"Caso, Mrs. Elisabeth  ","229 Watorloo St., St. John, N.B ",,Canada ,Sussex ,Nov.,"15, 1915."
4,1790,580,1826,3769,817025,Private ,"Casey, Alfred ",Nil  ,"Casey, Pascal ","Shodiao, Westmoreland Co., N.B...",,Canada ,Sussex ,Nov.,11.1915.
4,1819,579,1853,3769,817026,Private ,"Caton, Arthur   ",Nil.... ,"Caton, Mrs. James ","Stnnbrook, Thaxtod, Essex, Eng....",,England ,Sussex ,Nov.,"4, 1915."
4,1848,579,1882,3770,817241,Sergeant ,"Cave, Arnold  ",Nil..... ,"Cave, Mrs. Elisabeth ","Littlo River, St.John Co., N.B ",,England ,Sussex ,Nov.,"2, 1915."
4,1876,579,1910,3770,S17023,Private ,"Cavell, Burpee Webster ",Nil.....  ,"Cavell, James H ","20 Wator St., Wost St. John, N.B...",,Canada ,Sussex ,Nov.,"9, 1915."
4,1905,578,1938,3771,818227,Private ,"Chase, Howard Douglas ",Nil ,"Chase, Albert Edward ","Nashwaaksis, York Co., N.B ",,Canada ,"Wes, St. John..",Nov.,"26, 1916."
4,1934,577,1970,3770,817895,Private ,"Chase, Lewis Merritt.  ",Nil ,"Chase, Samuel ","Fronch Lako, Sunbury Co., N.B....",,Canada ,St. John ,Mar.,"1, 1916."
4,1962,576,1997,3771,817242,Private ,"Chase, Wilmot James ",Nil ,"Chase, Mrs. Fannie ","133 Hawthorne Ave., St. John, N.B.",,Canada ,Sussex ,Oct.,"29, 1915."
4,1991,576,2026,3772,817590,Private ,"Chester, Mike ",Nil ,"Hollett, Emery        ","Coronation, Carleton Co., N.B ",,Canada ,Sussex ,Dec.,"31, 1915."
4,2021,575,2055,3773,817027,Private ,"Chesworth, John ",Nil ,"Chesworth, Mrs. Dorothy E...","Black River Rd., St. John Co., N.B",,England ,Sussex ,Nov.,"10, 1915."
4,2049,575,2084,3773,817028,Corporal ,"Chetley, Robert White ",Nil ,"Chetley, Mrs. Jennie Etta ","83 Millidge Ave., St. John, N.B ",,Canada ,Sussex ,Nov.,"12, 1015."
4,2079,575,2113,3773,817433,Private ,"Chiasson, Charles Edward ",Nil ,"Chiasson, Edward ","Lameque, Gloucester Co., N.B ",,Canada ,Sussex ,Oct.,"27, 1915."
4,2108,576,2142,3774,817459,Private ,,Nil ,"Chiasson, William ","Lameque, Gloucester Co., N.B ",,Canada ,Sussex ,Oct.,27.1915.
5,375,700,406,3881,817209 Private ,Nil ,"Chisholm, Mrs. Margaret.","16 Middle St., St. John, N.B ",Canada ,,Nov.,11,1915.
5,404,700,436,3880,817210 Private ,Nil ,"Chown, Mrs. Nellie ","147 Rodney St., St. John, N.B  ",England ,,Nov.,3,1915.
5,434,699,465,3880,818000 Private ,Nil ,"Clark, George E ","P.O. Box 620, Brampton, Ont.   ",England ,West St. John...,Mar.,21,1916.
5,460,699,493,3880,818174 Private ,Nil ,"Thornton, Mrs. Florence..","Grafton, Carleton Co., N.B.  ",Canada ,West St. John...,April 11,1916.
5,493,1059,520,1547,"Clark, Sherdon John "
5,493,1059,522,3880,,Nil ,"Clark, Mrs. Annie ","Carlisle, Carleton Co., N.B ",Canada ,,Mar.,15,1916.
5,521,698,552,3880,,Nil ,817593 Private ,"Clarke, Franklin Murray..","Hartland, Carleton Co., N.B ",Canada ,Nov. 30,1915.
5,550,698,582,3880,817923 Private ,,"Blair, Mrs. Margaret ","Stanley, York Co., N.B ",Canada...:....,,Mar.,8,1916.
5,579,698,610,3880,817931 Private ,Nil ,"Clowater, Mrs. Jane  ","McNamee, Northumberland Co., N.B ",Canada ,,Mar.,9,1916.
5,610,1058,637,1546,"Coates, Arthur Robinson "
5,610,1058,639,3880,,C.F.A ,"Coates, Mrs. Violet ","Havelock, King’s Co., N.B ",Canada ,West St. John...,Mar.,29,i916.
5,638,698,669,3880,,Nil ,817630 Private ,"Cogham, Mrs. Lena ","181 Erin St., St.John, N.B ",Canada ,Nov. 15,1915.
5,667,698,697,3880,817031 Private ,Nil...,"Cobham, Mrs. Lena ","181 Erin St., St. John, N.B ",Canada ,,Nov. 15,1915.
