5,698,1562,728,3881,,Nil... .,"Coggins, Mrs. George ","Westport, Digby Co., N.S ",Canada ,,Sept. 24,1915.
5,725,698,756,3880,8*7595 Private ,Nil ,"Cole, Mrs. Ann ","Rowena, Victoria Co., N.B ",Canada ,,Jan.,5,1916.
5,754,697,785,3880,817596 Private ,Nil ,"Cole, William ","Tully’s Cottage, 5 Oak Green, nr Paddock, Kent,Eng..",England ,,Dec.,8,1915.
5,780,696,815,3881,817032 Sergeant ,,"Collett, Mrs. Myrtle E ","Marsh Bridge, St. John Co., N.B ",Canada ,,Nov. 16,1915.
5,809,696,844,3175,817913 Private ,Nil ,"Collett, Dorothy ","7 Grove Mansion, Tbe Grove, Hammersmith, London"
5,842,2455,872,3881,,,,"W., Eng ",England ,,Mar.,3,1916.
5,869,695,901,3880,818213 Private ,,"Collinga, Mra. Jano ","Marysville, York Co., N.B ",Canada ,West St. John...,May,1,1916-
5,899,695,930,3881,818114 Private ,Nil ,"Collins, James ","Barker’s Point, York Co., N.B ",Canada ,West St. John...,Mar. 30,1916.
5,928,695,959,3881,817034 Co. Q.-M. Sergt..,Nil ,"Collins, Mrs. Elizabeth ","127 Leinster St., St. John, N.B ",Canada ,,Nov. 15,1915.
5,957,695,988,3882,817245 Private ,Nil ,"Comeau, Mrs. Lizzie ","Chatham, Northumberland Co., N.B ",Canada ,,Nov.,4,1915.
5,987,1560,1017,3882,,Nil ,"Connell, Mrs. Mary ","181 Erin St., St. John, N.B..  ",Canada ,,Nov. 11,1915.
5,1016,1560,1046,3882,,Nil ,"Connell, Mrs. Mary. ","32 Frederick St., St. John, N.B.  ",Canada ,,Oct.,19,1915.
5,1043,695,1075,3882,817462 Private ,Nil ,"Connors, Peter ","Bass River, Kent Co., N\B   ",Canada ,,Sept.,1,1915.
5,1072,695,1104,3882,818234 Private ,Nil ,"Connors, Peter ","Hass River, Kent Co., N.B ",Canada ,,Aug.,11,1916.
5,1101,695,1134,3882,817246 Private ,Nil.... ,Conway j Mrs. Mary ,"254 Brussels St., St. John, N.B ",Canada ,,Dec.,29,1915.
5,1130,696,1161,3881,709116 Private ,Nil ,"Coram, Albert ","Middlesex, Albert Co., N.B ",Canada ,,Oct.,21,1915.
5,1159,1559,1190,3882,,Nil. .,"Cormier, David ","Loutz St., Moncton, N.B ",Canada ,,Sept. 28,1915.
5,1188,696,1219,3882,817247 Private ,Nil ,"Cormier, Tilda ","345 Loutz St., Moncton, N.B ",Canada  ,,Nov.,3,1915.
5,1217,695,1247,3882,817747 Private ,Nil ,"Cormier, David D ","6th St., Moncton, N.B ",Canada ,,Oct.,30,1915.
5,1242,696,1276,3881,817781 Private ,Nil ,"Corps, Mrs. Sarah ","205 Church St., Woking, Surrey, Eng ",England ,,Nov.,9,1915.
5,1275,1560,1305,3881,,Nil ,"Cowan, John ","Glasgow, Scot ",Scotland ,West St. John...,Mar.,30,1916.
5,1304,695,1334,3881,817248 Private ,Nil ,"Coyle, Mrs. Ella ","17 Brunswick St., St. John, N.B ",Canada ,Sussex ,Oct.,27,1915.
5,1328,1561,1363,3881,,Nil ,"Craft, Frank ","Spar Cove Rd., St. John, N.B   ",Canada ,West St. John...,Mar.,28,1916.
5,1357,695,1391,3881,817958 Private ,,"Craig, Mrs. Ethel ","Gordonsville, Carleton Co., N.B ",Canada ,,Mar.,14,1916.
5,1391,1561,1419,3880,,R.C.R ,"Stewart, Mrs. Angus ","Emerald Junction, Queen’s Co., P.E.I ",Canada ,,June,24,1916.
5,1415,694,1449,3881,,Nil ,817412 Private ,"Cram, George ","Broad Cove, Conception Bay, Nfld. ",Newfoundland.,Dec.,28,1915.
5,1448,1561,1477,3881,,Nil ,"Crandlemiro, Mrs. Mary ","Avondale, Carleton Co., N.B ",Canada ,,Nov. 30,1915.
5,1472,1560,1507,3881,,Nil ,"Cregan, Mrs. Jennie ","266J£ Pitt St., St. John, N.B   ",Canada ,,Nov.,3,1915.
5,1506,1560,1534,3881,,Nil ,"Crew, Mrs. Minnie ","259 Duke St., St. John, N.B ",Newfoundland.,,Oct.,21,1915.
5,1531,1559,1564,3881,,Nil ,"Parks, Mrs. Lydia ","Lawson, Queen’s Co., N.B.  ",Canada  ,,Nov. 12,1915.
5,1564,1890,1593,3881,,,"Crowley, Mrs. George ","213 Charlotte St., Fredericton, N.B ",Canada ,,Feb.,1,1916.
5,1593,694,1622,3881,817754 Private ,Nil ,"Cunningham, Mrs. Elizabeth.","71 Hawthorne Ave., St. John, N.B ",Ireland ,,Oct.,5,1915.
5,1622,1559,1652,3881,,Nil ,"Curry, Clyde J ","West St. John, N.B ",Canada ,,Oct.,19,1915.
5,1651,1558,1680,3882,,Nil ,"Cusack, Mrs. Myrtle ","Havelock, King’s Co., N.B   ",Canada ,West St. John...,Mar.,29,1916.
5,1680,1558,1710,3882,,Nil ,"Cyr, Mrs. Elizabeth ","590 Main St., St. John, N.B ",Canada ,,Sept. 27,1915.
5,1709,1558,1739,3882,,Nil ,"Daggett, Mrs. Kathleen ","Hickey Rd., St. John Co., N.B ",Canada ,,Oct.,19,1915.
5,1738,1557,1768,3882,,Nil ,"Daigle, Mrs. Elizabeth ","St. Charles, Kent Co., N.B ",Canada ,,Sept. 28,1915.
5,1762,1557,1797,3882,,Nil ,"Daigle, Israel ","Rexton, Kent Co., N.B ",Canada ,,Oct.,20,1915.
5,1791,694,1826,3883,817211 Private ,Nil ,"Dale, Mrs. Alice...; ","Port Elgin; Albert Co., N.B.   ",Canada ,,Oct.,16,1915.
5,1824,694,1855,3883,817880 Private ,Nil ,"Dale, Mrs. Catherine ","109 Queen St., St. John, N.B ",England ,,Feb.,25,1916.
5,1853,694,1884,3883,817212 Private ,Nil ,"Daley, Mrs. E ","16 Patrick St., St. John, N.B....; ",Canada ,,Nov.,15,1915.
5,1882,694,1912,3883,817213 Private ,Nil ,"Dargavel, Mrs. M ","Morelick River, Kent Co.. N.B ",Canada ,,Dec.,22,19i5.
5,1911,694,1946,3883,817785 Private ,Nil ,"Darrah, Mrs. Gertrude ","c/o Mrs. Thomas Carroll, Bellevue Ave., St. John, N.B",Canada...% ,Sussex ,Nov.,9,1915.
5,1940,693,1971,3883,817859 Private ,Nil ,"Day, Mrs. Annie ","119 Elliott Row, St. John, N.B ",British Guiana.,West St. John...,Feb.,23,1916.
5,1969,693,2001,3884,817465 Private ,Nil ,"Day, Mrs. Euphemia ","Blackville, Northumberland Co., N.B   ",Canada ,Sussex ,Dec.,15,1915.
5,1997,693,2029,3883,817787 Sergeant ,Nil ,"Dean, John E ","Dalhousie, Restigouche Co., N.B ",Canada ,,Dec.,30,1915.
5,2027,693,2058,3884,817940 Trumpeter Sergt.,Nil ,"DeBow, Mrs. Susan ","Forest Glen, Westmoreland Co., N.B ",Canada ,,Mar.,15,1916.
5,2052,692,2087,3884,817947 Private ,Nil ,"DeGrassc, Mrs. Alice ","Fernmount, Sunbury Co., N.B ",Canada ,,Mar.,10,1916.
5,2058,1052,2085,1538,"DeGrasse, Lorne Clowes "
5,2082,692,2117,3885,817414 Private ,Nil ,"Delaney, Albert ","Bass River, Kent Co., N.B ",Canada ,,Oct.,7,1915.
5,2087,1053,2115,1538,"Delaney, Henrv "
6,395,2020,435,2359,140th Battalion
6,522,3407,547,3717,Taken on Stkenqth.
6,572,775,604,3280,,,,Former Corps.,,,Country of
6,572,1151,596,1244,Name.
6,573,775,597,861,Rank.
6,574,1878,599,2190,Name of Noxt of Kin.
6,575,2513,601,2856,Address of Next of Kin.
6,604,3158,628,3246,Birth.
6,618,3640,642,3719,Date.
6,619,3400,643,3487,Place.
6,717,591,750,3773,818155,Private ,"DeLong, George William ",Nil ,"DeLong, Mra. Lottie May...","124 Queen St., Fredericton, N.B ",Canada ,St. John ,April,4.1916.
6,747,591,778,3773,817608,,,Nil..,Private ,"Dean, Mrs. Joseph ","Kilburn, Carleton Co., N.B ",Canada  ,Sussex ,Jan.,18. 1916.
6,776,590,808,3773,817611,Private ,,Nil ,"DeMerchant, Mra. Annie ","Bath, Carleton Co., N.B ",Canada  ,Sussex ,Dec.,"28, 1915."
6,806,590,837,3773,817609,Private ,"De Merchant, Howard ",Nil ,"DeMercUant, Norman ","Upper Kent, Carleton Co., N.B ",Canada  ,Sussex ,Jan.,18.1916.
6,835,590,865,3773,818048,,,Nil...,"Demorchant, John ","Bath, Carleton Co., N.B ",Canada  ,Sussex ,Jan.,5.1916.
6,862,590,896,3773,818211,Private ,"Dempster, William Albert ",,"Dempster, Mra. Maggie ","53 Westmoreland Rd., St. John, N.B ",Canada ,West St. John..,May,"29, 1916."
6,893,590,925,3773,818032,Private ,,Nil ,"Dennison, Mrs. Viva  ","Marysville, York Co., N.B ",Canada  ,West St. John...,Mar.,23.1916.
6,922,590,954,3773,818127,Private ,,,"Densmore, Thomas ","Grafton, Carleton Co., N.B ",Canada ,West St. John...,Mar.,30.1916.
6,950,590,982,3773,817256,Private ,"DeVenne, Freeland Kennedy ",Nil ,"DeVenne, Mrs. Clara Louise.","118 Rockland St., St. John, N.B ",Canada  ,Sussex ,Sept.,"13, 1915."
6,981,590,1012,3773,817613,,,Nil..,"DeWitt, Mrs. Fred ","Woodstock, Carleton Co., N.B ",Canada  ,Sussex  ,Jan.,"6, 1916."
6,1010,590,1041,3773,817612,,,Nil ,"DeWitt, Mrs. Carolina ","Centreville, Carleton Co., N.B ",Canada ,Sussex ,Jan.,6.1916.
6,1039,589,1071,3773,8180/4,Private ,,,"Dewley, Mrs. Daniel ","Mineral, Carleton Co., N.B ",Canada  ,West St. John...,Mar.,"27, 1916."
6,1067,590,1100,3774,817603,,,Nil ,"Dickinson, Mrs. Gladys ","Hartland, Carleton Co., N.B ",Canada  ,Sussex ,Nov.,30.1915.
6,1097,590,1128,3774,817257,,,Nil. .,"Dixon, Mrs. Kate ","Grand Falls, Victoria Co., N.B ",Canada ,St. John ,Jan.,13.1915.
6,1124,589,1158,3773,817826,,,,"Dixon, Mrs. A ","245 Sandy Point Rd., St. John, N.B ",Canada  ,Sussex ,Oct.,"1, 1915."
6,1154,589,1186,3774,817905,,,Nil ,"Dixon, Charles ","99 Elliott Row, St. John, N.B ",Canada ,St. John ,Mar.,"2, 1916."
6,1182,589,1216,3773,818252,,,Nil ,"Doak, Mrs. Modis ","Presque Isle, Me., U.S.A ",Canada ,Valcartier C’p..,July,"12, 1916."
6,1211,589,1245,3775,817729,,,Nil ,"Doiron, Joseph ","Rogersville, Northumberland Co., N.B ",Canada ,Sussex ,Nov.,4.1915.
6,1240,589,1274,3774,817403,,,Nil ,"Doning, David ","St. Joseph’s, Gloucester Co., N.B ",Canada ,Sussex ,Oct.,"26, 1915."
6,1269,589,1304,3775,817013,,,Nil ,"Donnelly, Mrs. James ","53 Carmarthen St., St. John, N.B ",Newfoundland.,Sussex ,Nov.,8.1915.
6,1299,589,1332,3775,817044,,,Nil ,"Donovan, Jeremiah ","627 Main St., St. John, N.B ",Canada ,Sussex ,Nov.,2. 1915.
6,1328,589,1362,3776,817403,,,Nil ,"Doron, Mrs. Elizabeth ","Blue Cove, Gloucester Co.. N.B ",Canada ,Sussex ,Sept.,29.1915.
6,1357,589,1391,3776,817415,,,Nil ,"Doucet, Peter.  ","Petit Rocher, Gloucester Co., N.B ",Canada ,Sussex ,Sept.,29.1915.
6,1386,589,1420,3775,817819,,,,"Douce tt, Henry  ","Campbellton, Gloucester Co., N.B ",Canada ,Sussex ,Oct.,"27, 1915."
6,1415,590,1449,3775,817015,,,Nil ,"Douett, Mrs. Jane ","177 Winslow St.. St. John West, N.B ",Canada ,Sussex ,Oct.,19.1915.
6,1444,590,1480,3776,818019,,"Douthwright, Benjamin Hartley..",Nil ,"Douthwright, Henry ","Forest Glen, Westmoreland Co., N.B ",Canada ,West St. John...,Mar.,"22, i916."
6,1473,590,1508,3775,818024,,,Nil ,"Douthwright, Henry ","Forest Glen, Westmoreland Co., N.B ",Canada ,West St. John.,Mar.,"22, 1916."
6,1502,590,1537,3775,818016,,,Nil ,"Douthwright, Henry ","Forest Glen, Westmoreland Co., N.B ",Canada ,West St. John...,Mar.,22.1916.
6,1531,589,1568,3775,817691,,,,"Dow, John....:;   ","Upper Woodstock, Carleton Co., N.B ",Canada ,Sussex ,Jan.,26.1916.
6,1560,590,1595,3776,817605,,,Nil ,"Doyle, Peter  J","New Waterford, C.B., N.S ",Canada ,Sussex ,Jan.,5.1916.
6,1587,589,1624,3776,818093,,,Nil ,"Drake, William H ",". Coldstream, Carleton Co., N.B ",Canada ,West St. John...,Mar.,28.1916.
6,1617,589,1653,3776,817469,,,Nil ,"Draper, Mrs. Srarah ","59 Oxford St., Birmingham, Eng.  ",Canada ,Sussex ,Nov.,17.1915.
6,1647,588,1681,3776,817607,,,Nil ,"Drost, Leonard ","Bath, Carleton Co., N.B ",Canada ,Sussex ,Feb.,2.1916.
6,1675,588,1711,3776,817603,,,Nil ,"Drost, Solomon ","Bath, Carleton Co., N.B ",Canada ,Sussex ,Jan.,26. 1916.
6,1705,587,1742,3776,817315,,,Nil ,"Duffell, Mary Elizabeth ","228 Pitt St., St. John, N.B ",Canada ,Sussex ,Nov.,"3, 1915."
6,1733,588,1769,3777,818003,,,Nil ,"Duffy, William B ","120 High St., Moncton, N.B  ",Canada ,St. John ,Mar.,"18, 1916."
6,1762,588,1799,3778,817786,,,Nil ,"Duffy, Mrs. Alice ","175 Chesley St.. St. John, N.B ",Canada ,Sussex ,Nov.,10.1915.
6,1791,587,1828,3779,818047,,,Nil ,"Dunham, Mrs. Kate  ","71 Lombard St., St. John, N.B ",Canada ,Sussex ,Nov.,10.1915.
6,1820,587,1858,3778,818020,,,,"Dunham, M ","Havelock, King,s Co., N.B ",Canada ,West. St. John.,Mar.,"22, 1916."
6,1849,586,1887,3779,818102,,,Nil ,"Dunham, Mrs. Isa ","Havelock, King’s Co, N.B ",Canada ,West St. John..,Mar.,"29, 1916."
6,1878,585,1920,3779,817982,,"Dwyer, Frank William ",Nil ,"Dwyer, Mrs. Katherine ","74 Wall St., St. John. N.B ",Canada ,St. John ,Mar.,17.1916.
6,1907,586,1946,3779,817499,,,Nil ,"Eatman, Mrs. Theresa ","239 Charlotte St., Fredericton, N.B ",Canada ,Sussex.. ,Dec.,"28, 1915."
6,1936,585,1978,3780,818274,,"Eccleston, James Henry ",Nil ,"Eccleston, Mrs. Rosie ","Manor Farm, Greet, Birmingham, Eng  ",England ,Valcartier C’p.,Sept.,20.1916.
6,1965,585,2005,3780,818263,,,R.C.G.A ,Eddleston. Mrs. Elizabeth...,"313 Princess St., St. John, N.B ",Canada ' ,St. John ,Aug.,11.1916.
6,2001,585,2034,3078,817049,,,,"Edwards, Mrs. Emily ","c/o Mis. Clayton, II Court House, Well St., Hockley."
6,2022,2348,2059,3780,,,,,,"Birmingham, Eng   ",England...,Sussex ,"Oct. 13,1915."
6,2052,584,2095,3782,817615,Private ,"Elliott, Paee Seymour ",Nil ,"Elliott, Charles...","Plaster Rock, Victoria Co., N.B ",Canada ,,"Jan. 10, 1916."
6,2062,584,2124,3784,818194,Private ,"Elliott, Walter Arnold ",Nil ,"Elliott, Mrs. Alice.","Lower Hainsville, York Co., N.B ",Canada ,wSt'.John.:,"April 15,1916."
6,2107,1451,2149,3784,,,,Nil ,"Ellis, Henry ","Tamworth, Staffs, Eng  ",England...,^Sussex ,Nov. 9. i915.
6,2129,583,2152,673,817616
6,2158,591,2181,660,•’I’.?'*
7,391,1560,425,3877,,,Nil ,"Ellis, Mrs. Ursula  ","38 Guilford St., St. John West, N.B ",Canada..,St. John ,|Aug.,"1, 1916."
7,420,697,455,3877,817931 Private ,,Nil ,"Ellison, Mrs. Sarah...:  ","18 Delhi St., St. John, N.B ",Canada..,St. John.....,Mar.,"8, 1916."
7,448,697,488,3877,818163 Private ,"Ellison, Frederick Joseph  ",C.G.A ,"Ellison, Mrs. Sarah ","18 Delhi St., St. John, N.B ",Canada..,West St. John..,April,"4, 1916."
7,478,1561,516,3877,,,Nil ,"Esligcr. Mrs. Maggie Jane.,.","Nash Creek, Restigouche Co., N.B ",Canada..,Sussex ,Oct.,"21, 1915."
7,507,1561,543,3877,,,Nil ,"Estey, Mrs. Alice M ","19 Bellevue Ave., St. John, N.B  ",Canada..,"Sussex...,..'...",Nov.,9.1915.
7,537,697,572,3877,817563 Private,,Nil ,"Evans, John   ","2ft Court House, Bishop St., Birmingham, Eng ",England.,Sussex ,Feb.,3.1916.
7,566,697,601,3877,817261 Private ..,,NO ,"Evereti, Mrs. Ethel ","39 Stanley St., St. John, N.B. ",Canada..,St ; John ,Ian.,4.1916.
7,595,1560,630,3878,,,Nil. ,"Ewart, Mrs. Zetta ","64 Guilford St., West St. John, N.B ; ",Canada..,Sussex ,Sept.,"15, 1915."
7,624,1561,659,3878,,,Nil ,"Moore, Mrs. Albert ","340 King St., St. John West, N.B ",Canada..,St. John ,Feb.,"2, 1916."
7,653,1561,688,3878,,,Nil ,"Farren, William J ","248 Guilford St., St. John, N.B ",Canada..,St. John ,Dec.,"21, 1915."
7,683,1560,717,3878,,,Nil ,"Steeves, Mrs. Elsie ","96 Bath Rd., Birmingham, Eng ",England.,Sussex.   ,Nov.,11.1915.
7,712,1560,746,3878,,,Nil ,"Fenton, Lawson  ","Hillsborough, Albert Co., N.B ",Canada..,West St. John.,Mar.,"22, 1916."
7,740,1560,777,3878,,,Nil ,"Fenton, Mrs. Margaret G...","25 Hollins Grove St., Darwcn, Lancs, Eng ",England.,Sussex  ,Nov.,10.1915.
7,771,1560,803,3878,,,Nil ,"flnermore, John ","Gladwyn, Victoria Co., N.B ",Canada..,St. John ,Mar.,"15, 1916."
7,799,1054,838,3877,,"Flannagan, James Thomas ",Nil ,Flannacan. Thomas  ,"Marysville, Yorft Co., N.B ",England.,,Jan.,26.1916.
7,829,1561,862,3878,,,Nil ,"Farley, Mrs. Elizabeth ","McGivney JunctiMi, York Co., N.B ",Canada..,West St. John..,Mar.,"30, 1916."
7,856,1560,892,3878,,,Nil ,Flewelling. R-ed D ,"Avondale, Carleton Co., N.B ",Canada..,West St. John..,April,"11, 1916."
7,887,1560,921,3878,,,Nil ,"Fli mining, John.","Woodstock, Carleton Co., N.B ",Canada..,West St. John..,Mar.,"23, 1916."
7,916,1560,951,3878,,,Nil ,"Fogan, Mrs. Mary J  ","Newcastle, Northumberland Co., N.B ",Canada..,Sussex. .,Sept.,27.1915.
7,945,1560,979,3878,,,Nil ,"Foley, Mrs. Annie ","32 Sydney St., St. John, N.B.   ",Canada..,St. John ,Jan.,"21, 1916."
7,974,1559,1008,3879,,,Nil ,"Foley, William. ,","Caraquet, Gloucester Co., N.B. ",Canada..,Sussex ;...,Oct.,"27, 1915."
7,1003,1560,1036,3879,,,Nil ,"Ford, Mrs. Eleanor M  ","McAdam Junction, York Co., N.B ",England.,West St. John.,Mar.,"23, 1916."
7,1032,1559,1065,3879,,,Nil ,"Forrester, Mrs. Elizabeth May.","321 Campbell St., Fredericton, N.B ",Ireland..,St. John..:;...,Mar.,"3, 1916."
7,1059,692,1095,3175,818170 Private...,,Nil ,"Forster, Mrs. Ethel Louise  ","cio C. M. Muskett, 16 Woodside, Hexham, N’humber-"
7,1065,3823,1079,3867,■-'j'
7,1088,2448,1122,3879,,,,,"1 and, Eng : ",England  ,West St. John..,April,8.1916.
7,1118,692,1154,3879,818120 Private ,"Foster, Charles John ",Nil ,"Foster, Mrs. Margaret Ann ","North Tay, York Co., N.B ",Canada ,West St. John..,Mar.,30.1916.
7,1147,1559,1180,3879,,,Nil ,"Foster, Daniel   ","Burtt’s Corner, York Co., N.B .' ",Canada ,West Pt. John..,Mar.,"22, 1916."
7,1176,1559,1209,3879,,,Nil ,"Foster, Daniel ","Burtt’s Corner, York Co., N.B ",Canada... ,"West St. John.,",Mar.,"22, 1916."
7,1204,1558,1239,3879,,,Nil ,"Foster, Mrs. Mary ","217 Brunswick St., Fredericton, N.B ",Canada ,St. John ,Mar.,14.1916.
7,1234,1558,1269,3879,,,Nil ,"Montford, Mrs. Elsie May ","617 King St., Fredericton, N.B ",England ,Sussex.........,Nov.,"1, 1915."
7,1263,1558,1297,3879,,,Nil  ,"Fraser, William ","Prince William, York Co., N.B ",Canada ,West St. John..,Mar.,"28, 1916."
7,1293,1558,1326,3875,,,Nil ,"Fraser, Mrs. Jemima ","4<H Union St., St. John, N.B ",Canada ,St. John ,Jan.,"21, 1916"
7,1322,1557,1354,3880,,,Nil ,"Fraser, Mrs. Jemima ","404 Union St., St. John, N.B   ",Canada ,Sussex ,Nov.,10. 1915.
7,1350,1886,1383,3879,,,,"Sewell, Mrs. William ","Fredericton, N.B  ",Canada ,St. John ,Jan.,22.1916.
7,1380,690,1414,3880,817055 Private ,"Fulton, Ernest Franklin ",C.G.A ,Fulton. Mrs. Charity Elizabeth.,"14 Prince St., St. John West, N.B ",Canada ,Sussex ,Nov.,18.1915.
7,1408,1556,1442,3880,,,Nil  ,"Fultz, Mrs. Catherine ","270 Gottingen St., Halifax, N.S ",Canada ,Halifax ,Nov.,"25, 1915."
7,1437,1555,1471,3881,,,NU ,"Furlong, Peter ","Nash Creek, Restigouche Co., N.B ",Canada ,Sussex ,Oct.,"22, 1915."
7,1466,1555,1501,3879,,,Nil ,"Furlotte, Mrs. Bridget ","Jacquet River, Restigouche Co., N.B...., ",Canada ,West St. John.,April,"15, 1916."
7,1495,1555,1529,3879,,,NU ,"Gagnon, Mrs. David ","Grand Falls, Victoria Co., N.B ",Canada ,Sussex ,Sept.,"24, 1915."
7,1524,1554,1558,3879,,,Nil ,"Galbraith, John J ","Lorneville, St. John Co., N.B....; ",Canada ,St. John ,Jan.,"17, 1916."
7,1553,1554,1587,3880,,,NU ,"Galbraith, Joseph ","Lorneville, St. John Co., N.B ",Canada ,Sussex ,Nov.,"11, 1915."
7,1582,1554,1617,3879,,,NU ,"Gallagher, Mra. Maggie ","Zionville, York Co., N.B ",Canada ,St. John ,Mar.,"9, 1916."
7,1610,1554,1646,3880,,,Nil ,"Gallop, Mrs. Emily  ",Birch Ridge Victoria Co.; N.B ,Canada ,,Dec.,"31, 1915."
7,1640,1047,1681,3880,,"Gaudet, Cyril Lezin ",NU ,"Gaudet, Mrs. M ","Comeauville, Digby Co., N.B ",Canada ,Sussex.,Dec.,"14, .915."
7,1668,1553,1702,3880,,,Nil.... ,"Gaudet, Amos ","11 Daniel St., Fitchburg. Mass., U.S.A ",Canada ,Sussex.,Nov.,"10, 1915."
7,1698,1553,1732,3880,,,Nil ,"Gauvin, Mrs. Osit  ","8 Spring St., Moncton, N.B ",Canada ,,Nov.,17.1915.
7,1727,1553,1760,3880,,,NU ,"Gauvin, Mrs. Osit...   ","8 Spring St., Moncton, N.B ",Canada ,,Nov.,17.1915.
7,1755,1552,1791,3880,,,Nil ,"Gee, Mrs. Mary   ","Bath, Carleton Co., N.B ",Canada ,"Sussex,",Jan.,18.1916.
7,1782,1552,1818,3880,,,Nil ,"Geldart, Mrs. Rebecca ","lake Rd., Albert Co., N.B ",Canada ,Sussex ,Sept.,27.1915.
7,1814,1552,1846,3880,,,Nil ,"Giberson, Elwood ","Plaster Rock, Victoria Co., N.B ",Canada ,West St. John.,Mar.,31.1916.
7,1843,1044,1877,3880,,"Gibson, Lincoln ",Nil ,"Gibson, Mrs. Mary L  ","Lower Southampton, York Co., N.B ",England ,Sussex ,Feb.,9.1916.
7,1872,685,1905,3880,817442 O.-R. Sergeant...,,Nil ,"Gillespie, John  ","77 Weldon St., Moncton, N.B ",Canada ,Sussex ,Oct.,"5,1915."
7,1901,1550,1934,3880,,,Nil ,"Gillespie, Richard ","Chamcook, Charlotte Co., N.B ",Canada ,St. John ,May,"20, 1916."
7,1930,1550,1964,3880,,,Nil ,"Fleming, Mrs. Thomas  ","Dock Gates, Ayr, Scot ",Scotland ,Frederick ,Aug.,24.1916.
7,1959,1879,1992,3880,,,,"Gilmore, Frederick ","Stanley, York Co., N.B ",Canada ,St. John ,Jan.,22.1916.
7,1988,1549,2021,3880,,,Nil ,"Girouard, Simon M ","♦0 Cornhill St., Moncton, N.B ",Canada.  ,Sussex ,Oct.,"11, 1915."
7,2016,1548,2050,3881,,,Nil ,"Stockford, Mrs. Edith ,","Lower Windsor, Carleton Co., N.B ",Canada..' ,West St. John.,April,"5, 1916."
7,2046,1547,2078,3881,,,Nil ,"Godin, Frank ","St. Joseph, Westmoreland Co., N.B ",Canada ,Sussex ,Oct.,"26, 1915."
7,2075,1547,2108,3881,,,Nil ,"Goldie, Mrs. Grace. ","Milford, West St. John, N.B ",Canada ,Sussex ,Nov.,"3, 1915."
7,2103,671,2138,3881,10300951 Private ,"Goodine, Bartholomew ",Nil ,"Goodine, Mra. Margaret ","345 City Rd., St. John, N.B ",Canada ,Fredericton ,Aug.,21.1916.
8,408,2021,447,2362,140th Battalion
8,534,3418,557,3561,Taken on
8,559,616,626,670,¥
8,583,782,606,866,Rank.
8,583,782,612,3287,,,Former Corps.,,Country of
8,583,1154,607,1248,Name.
8,585,1883,610,2260,Name of Next of Kin. '
8,586,2517,610,2861,Address of Next of Kin.
8,613,3165,636,3252,Birth.
8,627,616,665,640,&
8,628,3409,651,3494,Place.
8,629,3649,652,3727,Date.
8,727,672,758,3781,8 Private ,,Nil ,"Spring Hill, York Co., N.B .  ",,,Mar.,"14,1916."
8,756,672,785,3781,0 Corporal ,"Gorman, Charles Ingraham ",Nil ,,,,Nov.,10.1915.
8,785,1459,816,3781,,,Nil ,"174 State St., New Bedford, Mass., U.S.A ",,,Nov.,15.1915.
8,814,3582,838,3653,Nov.
8,814,3668,840,3781,17.1915.
8,843,1458,869,3781,,,Nil.... ,,,,Jan.,28.1916.
8,872,1458,898,3780,,,Nil ,,,Sussex ,Nov.,"26, 1915."
8,900,672,930,3780,,,,,,West St. John...,4 Private ,"Graham, Stanley Charles ",Nil ,June,"It, 1916."
8,930,672,958,3780,,,,,,Sussex ,0 Private ,"Grant, Florian ",Nil ,Sept.,"29, 1915."
8,959,672,987,3780,,,,,,West St. John...,5 Private ...,"Grant, George   ",Nil ,July,"5, 1916."
8,988,672,1014,3780,6 Private ,,Nil ,,,,Feb.,"15, 1916."
8,1016,672,1046,3780,4 Private ,"Grant, Harry Lockhard ",Nil ,,,West St. John...,Mar.,"23, 1916."
8,1045,672,1073,3781,B Private ,,Nil ,,,,Sept.,"28, 1915."
8,1074,672,1102,3781,2 Private ,"Grant, Ranon ",Nil ,,,,Mar.,"1, 1916."
8,1103,672,1132,3782,2 Private ,"Grant, Reuben Edgar.  ",Nil ,,,,Oct.,"20, 1915."
8,1132,695,1163,3782,Private ,"Grant, William DeLoss ",Nil.. ,"Sioux Falls, S.D., U.S.A ",,,Oct.,"23, 1915."
8,1161,672,1189,3782,7 Private ,"Graves, Walker Katon ",Nil ,,,,Jan.,"26, 1916."
8,1190,672,1219,3782,5 Private ,"Gray, Gerald ",Nil ,,,West St. John...,Mar.,18.1916.
8,1219,695,1248,3782,Private ,"Gray, William Stan worth ",Nil ,,,,Nov.,4.1915.
8,1248,672,1276,3782,3 Private ,"Green, Grover Cleveland ",Nil : ,,,,Jan.,14.1916.
8,1277,695,1305,3782,Private ,"Green, Pearlie Halford ",Nil ,,,,Feb.,5.1916.
8,1305,672,1335,3781,3 Private ,"Greer, Charles Wilmot.   ",C.F.A ,,,,Sept.,10.1915.
8,1335,672,1364,3781,3 Private ,"Greer, George Dow ",Nil ,,,,Mar.,2.1916.
8,1363,694,1392,3780,Private ,"Greer, Fred Lewis ",Nil ,,,St. John ,Mar.,9.1916.
8,1392,693,1422,3780,Private ,"Gregory, Guy Wardlaw ",Nil ,,,,Nov.,17.1915.
8,1421,693,1450,3780,Private ,"Griffin, Patrick Frank ",Nil ,,,,Sept.,24.1915.
8,1450,693,1480,3779,Private ,"Griffiths, John Stephen ",Nil ,,,,Oct.,"13, 1915."
8,1479,692,1508,3779,Private ,"Grondin, Andrew ",Nil ,,,West St. John...,Mar.,23.1916.
8,1508,692,1537,3780,,,,,,Sussex ,Private ,"Gunn, Harry James ",Nil ,Sept.,18.1915.
8,1537,691,1568,3779,,,,,,West St. John...,Private ,"Haines, Everette Charles ",Nil ,"Burtt’s Corner, York Co., N.B ",Mar.,29.1916.
8,1566,691,1593,3780,Private ,,Nil ,,,,Mar.,"1, 1916."
8,1595,691,1622,3780,Private ,,Nil ,,,,Nov.,"23, 1915."
8,1623,690,1652,3780,Private ,"Haines, Woodford ",Nil ,,,,April,20.1916.
8,1653,690,1681,3780,Sergeant ,"Hale, Thomas Edward ",R.C.R ,,,Sussex ,Dec.,"14, 1915."
8,1682,690,1708,3781,,,Nil ,Private ,,,Nov.,"19, 1915."
8,1710,690,1740,3782,Private ,,Nil ,"15 Middle St., St. John, N.B...",,Sussex ,Nov.,"15, 1915."
8,1738,690,1767,3783,Private ,,Nil ,,,,Sept.,13.1915.
8,1767,689,1798,3782,Private ,"Hancox, William Harry ",Nil ,,,West St. John...,Mar.,"20, 1916."
8,1796,690,1824,3783,,,,,,Sussex ,Private ,Nil....,Nov.,"12, 1915."
8,1825,949,1855,3783,,"Harriman, Benson Stafford ",C.F.A ,,,,Nov.,2.1915.
8,1854,688,1883,3783,,,Nil...,Private ,,Sussex ,Sept.,"29, 1915."
8,1883,688,1911,3783,Private ,,Nil...,,,,Feb.,4.1916.
8,1912,688,1943,3782,Private ,"Harrison, George Namen... ",Nil ,,Canada ,West St. John...,Mar.,23.1916.
8,1941,687,1970,3783,,,,,,Sussex ,Private ,Nil...,Jan.,5.1916.
8,1970,688,2001,3782,Private ,,Nil....,"Plaster Rock, Victoria Co., N.B   ",,,June,17.1916.
8,1998,688,2034,3783,Private ,"Hartsgrove, George Andrew ",Nil ,,U.S.A ,West St. John...,April,14.1916.
8,2004,1784,2034,2276,"Hartsgrove, Mrs. Esther Mary—"
8,2027,687,2059,3783,,,,,U.S.A ,Sussex ,Private ,"Hartsgrove, John ",Nil ,"Glassville, Carleton Co., N.B ",Dec.,31.1915.
8,2057,687,2088,3783,,,,,,West St. John...,"Bath, Carleton Co., N.B ",Private ,"Hartsgrove, Murrell Clifton ",Mar.,27.1916.
8,2085,687,2117,3783,,,,,,West St. John...,Private ,"Hartsgrove, William I^slie ",Nil ,April,15.1916.
8,2115,685,2146,3784,Private ,"Hartt, Samuel Harold ",Nil ,"Perth, Victoria Co., N.B ",Canada ,,Jan.,10.1916.
9,396,708,426,3885,817065,Private.,"Hasson, Thomas Herbert ",Nil ,"Hasson, Thomas ","Armstrong’s Corner, Queen’s Co., N.B ",,,"Nov. 10, 1915."
9,426,708,456,3885,817066,Private..,"Hatfield, Ralph Everett ",Nil ,"Hatfield, Mrs. Agnes ","154 Main St., St. John, N.B ",Canada ,,"Nov. 11,1915."
9,455,708,486,3885,817921,Sergeant.,"Havens, Harry Wilfred ",Nil ,"Havens, Mrs. Alice ","Portland, Me., U.S.A  ",Canada ,,"Dec. 18,1915."
9,485,708,514,3885,817037,Private...,"Hawks, Frederick George...",Nil ,"Hawkes, Mrs. Emily ","The Range, Queen’s Co., N.B.... . ",,,"Nov. 29,1915."
9,514,708,545,3884,817813,Sergeant.,"Hay, Cloran John ",Nil ,"Hay, Ambrose S ","Central Blissville, Sunbury Co., N.B ",,,"Nov. 3,1915."
9,543,707,575,3884,817068,Private...,"Hayes, Joseph Bertain .■ ",Nil ,"Hayes, John ","129 Marsh Rd., St. John, N.B ",,,"Nov. 9, J915."
9,572,708,604,3884,817854,Corporal.,"Hayward, Russell Perley ",Nil ,"Hayward, Mrs. Gertrude L..","Waasis, Sunbury Co:, N.B ",Canada ,West St. John...,"Feb. 16, 1916."
9,601,707,632,3885,818235,Private...,"Hazelett, Chester Albert. ...",Nil ,"Hazelett, Mrs. Alice ","Nashwaaksis, York Co., N.B ",,West St. John...,Canada ,"June 3,1916."
9,631,706,663,3884,817483,Private...,"Hebert, George Sixtus ",Nil ,"Hebert, Mrs. Mary ","136 L«wis St., Moncton, N.B ",,,"Nov. 29,1915."
